{
  "analysis_status": "complete",
  "claim": {
    "claim_context": "Active atomic proposition R-01 from the frozen ASA 25/261 Premium Grounding claim registry (origin F13; type EXPLICIT; PHYSIOLOGICAL/FUNCTIONAL; PRODUCT-SPECIFIC). Frozen evidence-preparation state: MIXED / CONFLICTING. Routing: STANDARD BIOMEDICAL ADJUDICATION",
    "claim_scope": "PRODUCT MISMATCH | PRODUCT EQUIVALENCE UNCERTAIN | mixed replication",
    "claim_source_reference": "INSPEKTORIUM Premium Grounding ASA 25/261 Final Evidence Freeze v1, sections 12/48; evidence cut-off 2026-08-22",
    "claim_text": "Premium Grounding accelerates recovery from exercise.",
    "intended_reader_or_audience": "General consumer audience of a website health advertisement."
  },
  "development_or_production_status": "production",
  "evidence": {
    "contradicting_or_limiting": [
      "H27 direct acute null (product mismatch, different construct)",
      "H06 48 outcomes with a nonstandard threshold",
      "H16 pain occurred in both groups",
      "H23 n=22 with a biomarker subset of 4",
      "No registered, powered, exact-product recovery trial"
    ],
    "evidence_items": [
      {
        "role": "supporting",
        "source_reference": "H23",
        "text": "Müller et al. 2019: randomised triple-blind, 22 sport and physiotherapy students (12 grounded, 10 sham), grounded versus sham sleep for 10 nights after downhill treadmill running; smaller decline in selected performance measures and a smaller creatine-kinase rise.",
        "tier": "limited_human",
        "why_it_matters": "The strongest recovery evidence and the only clearly independent positive group, outside the core author network. Blood biomarker subset n=4."
      },
      {
        "role": "supporting",
        "source_reference": "H16/H11",
        "text": "Brown, Chevalier & Hill 2015 DOMS biomarkers (creatine kinase day 2 p=.04, neutrophils p=.05) and Sokal et al. 2013 lower urea at sampled timepoints.",
        "tier": "biomarker",
        "why_it_matters": "Directionally consistent biomarker signals, but selected from many outcomes and timepoints."
      },
      {
        "role": "contradictory",
        "source_reference": "H27",
        "text": "Muniz-Pardos et al. 2022: randomised crossover in 10 elite male runners, grounded versus non-grounded shoes over a 20-minute run; no difference in oxygen uptake, heart rate, lactate, fatigue or running economy.",
        "tier": "limited_human",
        "why_it_matters": "A direct objective null, but on acute performance rather than recovery and with a mismatched product. The freeze prohibits generalising a grounded-shoe null to all grounding settings."
      },
      {
        "role": "weakening",
        "source_reference": "H06",
        "text": "Brown, Chevalier & Hill 2010: randomised double-blind pilot in 8 healthy young men with selected differences among 48 outcomes under a nonstandard threshold of at least 10 percent.",
        "tier": "limited_human",
        "why_it_matters": "Extreme multiplicity and imprecision; a feasibility signal only."
      },
      {
        "role": "missing_expected",
        "source_reference": "Freeze section 63",
        "text": "No registered, powered recovery trial with multiplicity control and the exact product was located.",
        "tier": "not_applicable",
        "why_it_matters": "No study addresses the advertised product or the general audience."
      }
    ],
    "evidence_sufficiency": "insufficient",
    "evidence_sufficiency_rationale": "Sufficient for a bounded statement about eccentric-exercise recovery protocols; insufficient for the advertised general claim.",
    "missing_causal_chain": false,
    "missing_comparison_group": false,
    "missing_human_evidence": false,
    "supporting": [
      "H23 independent randomised triple-blind recovery signal",
      "H16 DOMS biomarkers",
      "H11 urea and creatinine surrogates"
    ]
  },
  "failure_modes": {
    "detected": [
      {
        "evidence_refs": [
          "H23"
        ],
        "mode": "inappropriate_generalization",
        "rationale": "A 22-participant eccentric-exercise protocol in sport students is extended to recovery for the general advertised audience."
      },
      {
        "evidence_refs": [
          "H23",
          "H06",
          "H27"
        ],
        "mode": "conclusion_exceeds_results",
        "rationale": "An established recovery benefit is advertised while the supporting trials are small and multiply tested and a direct objective test found nothing."
      }
    ],
    "none_detected": false
  },
  "generated_at": "2026-08-23",
  "provenance": {
    "analysis_source": "agent_arena claim-forensics adjudication",
    "audit_trail": [
      "input validated against forensic_report schema 6.3.0",
      "analysis_status=complete",
      "confidence classified as VALID (no coercion to 0.0)",
      "2 failure mode(s) echoed from analysis (not inferred)",
      "rewrite guard: no rewrite supplied"
    ],
    "input_digest_sha256": "a9d369b4193929995f254aa6e4c2a1613acba1ae8a1b3c571ca19691219e57c4",
    "model": "claude-opus-5",
    "parser_status": "ok",
    "prompt_contract_version": "ASA_25_261_MASTER_EXECUTION_PROMPT_RUN_001",
    "provider": "anthropic",
    "report_generation_digest_sha256": "b2b8feea97aa7fb450eb2e443c9835c1cd51a86b70dd111439eb01b504e10375",
    "repository_commit": "84d75d4b3d931090500151a23c3ef939e910cde0",
    "warnings": []
  },
  "reader_impact": {
    "affected_decision_type": "Purchase for training and recovery support.",
    "likely_reader_misunderstanding": "That faster recovery is an established, generalisable product effect.",
    "not_a_harm_probability_note": "Reader-impact risk is a qualitative category describing how a non-specialist might misread the claim. It is NOT a computed medical, legal, or financial harm probability.",
    "risk_level": "moderate",
    "risk_rationale": "Exercise recovery claims carry limited clinical risk; the main exposure is misplaced purchase reliance.",
    "risk_uncertainty": null
  },
  "recommended_revision": {
    "claims_that_remain_supportable": [],
    "claims_to_remove_or_narrow": [],
    "defensible_rewrite": null,
    "evidence_qualifiers_to_add": [],
    "rewrite_available": false,
    "rewrite_guard": {
      "checked": true,
      "status": "no_rewrite",
      "unsupported_new_facts": []
    },
    "rewrite_rationale": "Out of scope for RUN 001: this run adjudicates the frozen wording only. Replacement claim language occurs downstream after verdict freeze.",
    "rewrite_verification": "no_rewrite_supplied",
    "rewrite_verification_note": "This rewrite is an UNVERIFIED proposal copied from the analysis input. The numeric-containment guard only checks that it introduces no unsupported number; it does NOT verify factual or semantic accuracy. Its factual support still requires human review."
  },
  "report_id": "ASA-25-261-run_001-R-01",
  "report_schema_version": "6.3.0",
  "status_banner": [
    "DEVELOPMENT PROTOTYPE — claim-forensics report (Phase 6.3)"
  ],
  "synthetic_fixture": false,
  "uncertainty": {
    "alternative_label_rationale": "A solid reading was considered on the strength of H23, an independent randomised triple-blind trial. It is rejected as primary because the advertised wording is unqualified for a general audience while the evidence is small, heterogeneous and includes a direct objective null.",
    "alternative_plausible_label": "solid",
    "ambiguity": "MATERIAL AND DECISIVE — the Steelman layer established a genuine independent positive trial and correctly limited the null's reach on product-mismatch grounds; the adversarial layer established that the trials are small, multiply tested and unregistered. Resolved as QUALIFIED, with the evidence state recorded as mixed.",
    "confidence_caveat": "Model's self-assessed probability that its own primary classification is correct (Phase 6.1 semantics). Not a calibrated probability.",
    "development_caveat": null,
    "missing_evidence": [
      "H27 direct acute null (product mismatch, different construct)",
      "H06 48 outcomes with a nonstandard threshold",
      "H16 pain occurred in both groups",
      "H23 n=22 with a biomarker subset of 4",
      "No registered, powered, exact-product recovery trial"
    ],
    "scope_limitations": [
      "Adjudication is bounded to the frozen evidence substrate at the 2026-08-22 cut-off. No new literature discovery was performed.",
      "The ASA regulatory outcome is quarantined and contributes no scientific inference."
    ],
    "unresolved_questions": [
      "A registered, powered recovery trial with multiplicity control and the exact product has not been performed."
    ]
  },
  "verdict": {
    "classification_note": "A forensic classification describes the relationship between the claim and the cited evidence. It is not, by itself, proof that the claim is factually false.",
    "confidence_interpretation": "Model's self-assessed probability that its own primary classification is correct (Phase 6.1 semantics). Not a calibrated probability.",
    "confidence_status": "VALID",
    "confidence_value": 0.75,
    "predicted_label": "overclaim",
    "verdict_summary": "An independent randomised triple-blind trial reported a smaller performance decline and a smaller creatine-kinase rise over ten nights after eccentric exercise, supported by biomarker signals from other groups. A separate randomised crossover found no acute effect, but it tested grounded footwear and running economy rather than recovery. Bounded support exists in eccentric-exercise recovery protocols; the advertised general claim does not follow.",
    "verdict_title": "Claim goes beyond the available evidence"
  }
}
